{
  "$schema": "https://json-schema.org/draft/2020-12/schema",
  "additionalProperties": false,
  "properties": {
    "active_slots": {
      "minimum": 0,
      "type": "integer"
    },
    "max_active_slots": {
      "minimum": 0,
      "type": "integer"
    },
    "max_queued_unlocks": {
      "minimum": 0,
      "type": "integer"
    },
    "slot_cost": {
      "properties": {
        "currencies": {
          "patternProperties": {
            ".{1,}": {
              "minimum": 0,
              "type": "integer"
            }
          },
          "type": "object"
        },
        "items": {
          "patternProperties": {
            ".{1,}": {
              "minimum": 0,
              "type": "integer"
            }
          },
          "type": "object"
        }
      },
      "type": "object"
    },
    "slots": {
      "minimum": 0,
      "type": "integer"
    },
    "unlockables": {
      "patternProperties": {
        ".{1,}": {
          "properties": {
            "additional_properties": {
              "patternProperties": {
                ".{1,}": {
                  "type": "string"
                }
              },
              "type": "object"
            },
            "category": {
              "pattern": ".{1,}",
              "type": "string"
            },
            "cost": {
              "properties": {
                "currencies": {
                  "patternProperties": {
                    ".{1,}": {
                      "minimum": 0,
                      "type": "integer"
                    }
                  },
                  "type": "object"
                },
                "items": {
                  "patternProperties": {
                    ".{1,}": {
                      "minimum": 0,
                      "type": "integer"
                    }
                  },
                  "type": "object"
                }
              },
              "type": "object"
            },
            "cost_unit_time_sec": {
              "minimum": 0,
              "type": "integer"
            },
            "description": {
              "pattern": ".*",
              "type": "string"
            },
            "name": {
              "pattern": ".{1,}",
              "type": "string"
            },
            "probability": {
              "minimum": 0,
              "type": "integer"
            },
            "reward": {
              "$ref": "Hiro-Rewards"
            },
            "start_cost": {
              "properties": {
                "currencies": {
                  "patternProperties": {
                    ".{1,}": {
                      "minimum": 0,
                      "type": "integer"
                    }
                  },
                  "type": "object"
                },
                "items": {
                  "patternProperties": {
                    ".{1,}": {
                      "minimum": 0,
                      "type": "integer"
                    }
                  },
                  "type": "object"
                }
              },
              "type": "object"
            },
            "wait_time_sec": {
              "minimum": 0,
              "type": "integer"
            }
          },
          "required": [
            "probability",
            "name"
          ],
          "type": "object"
        }
      },
      "type": "object"
    }
  },
  "type": "object"
}
